{
  "$schema": "./schema/ai.schema.json",
  "status_options": [
    {
      "id": "learning",
      "label": "Learning"
    },
    {
      "id": "review",
      "label": "Needs review"
    },
    {
      "id": "known",
      "label": "Know it"
    }
  ],
  "topics": [
    {
      "id": "ai-sre",
      "name": "AI SRE",
      "pinned": true
    },
    {
      "id": "llm-basics",
      "name": "LLM basics"
    },
    {
      "id": "tradeoffs",
      "name": "Model trade-offs"
    },
    {
      "id": "rag",
      "name": "RAG"
    },
    {
      "id": "agents",
      "name": "Agents"
    },
    {
      "id": "evals",
      "name": "Evals"
    },
    {
      "id": "observability",
      "name": "Observability"
    }
  ],
  "cards": [
    {
      "id": "ai-sre-anchor",
      "topic": "ai-sre",
      "pinned": true,
      "question": "How would you use AI to cut MTTD and MTTR?",
      "short": "Start with diagnosis: gather telemetry and recent changes, retrieve relevant incidents, and rank causes with evidence. Run authorized, bounded diagnostics; put mitigations behind approval and rollback checks. Evaluate hypothesis quality on time-correct incident replay, then use shadow mode and controlled rollout to measure whether engineers actually detect and resolve incidents faster.",
      "terms": [
        "MTTD (mean time to detect): how long until someone knows something is wrong.",
        "MTTR (mean time to resolve): how long until it is fixed.",
        "Golden set: past incidents with known root causes, used as a test.",
        "Abstain: the agent says it is not sure instead of guessing.",
        "Reversible mitigation: a fix you can undo, like a rollback or scaling up."
      ],
      "long": [
        "Detect: group related alerts into one incident and alert on SLO burn, so the page comes sooner and only once.",
        "Gather context: pull metrics, logs, traces, deploys, and config changes for the affected service and time window.",
        "Retrieve: hybrid search, keyword plus vector, over past incidents and runbooks, filtered by service and error signature.",
        "Rank hypotheses: the LLM proposes the top causes, each citing evidence from tool output; below a confidence bar it abstains.",
        "Act safely: authorized read-only diagnostics run within time and query budgets; mitigations need approval, a blast-radius check, and a tested rollback.",
        "Close the loop: draft the RCA, add the resolved incident to the index, and replay the golden set before any prompt or model change ships."
      ],
      "followups": [
        {
          "q": "What are the main risks?",
          "a": "Hallucinated causes (require citations, abstain when weak), stale runbooks (freshness dates, downrank old ones), alert storms (group first, cap concurrent investigations), and runaway cost (step and token budgets per incident)."
        },
        {
          "q": "How do you prove it works before trusting it?",
          "a": "Start with replay, then shadow mode: compare ranked causes and proposed-action quality with human review. Shadow mode validates suggestions but cannot establish the effect on human MTTR. Measure that in a controlled suggestion rollout before approval-gated actions and narrow automation."
        },
        {
          "q": "Where does most MTTR go?",
          "a": "I would measure detection, diagnosis, and mitigation separately instead of assuming one dominates. Retrieval helps context gathering and diagnosis; ask the HM where their engineers currently lose time."
        }
      ],
      "tie": "This is my Oracle tool, which cut P1 MTTR from 94 to 26 minutes with auto-tagged root causes and runbooks, rebuilt with retrieval and LLM ranking, plus my MSRcosmos confidence routing for anything that acts."
    },
    {
      "id": "ai-sre-eval",
      "topic": "ai-sre",
      "pinned": true,
      "question": "How do you evaluate an AI SRE agent?",
      "short": "Replay past incidents with known root causes. Give the agent only the data that existed at the time, then score whether the true cause is in its top 3, how fast it got there, how often it proposed a wrong action, and how often it abstained. Every prompt or model change has to pass that replay.",
      "terms": [
        "Replay: rerun the agent on a past incident as if it were happening now.",
        "Time travel: tools only return data from before the incident was resolved.",
        "Top-3 accuracy: the real root cause is among the agent's top 3 guesses.",
        "Wrong-action rate: how often it proposes a harmful or useless fix.",
        "Regression gate: a check that blocks a release if scores drop."
      ],
      "long": [
        "Build the golden set from postmortems: symptoms, timeline, root cause, fix.",
        "Snapshot tool outputs or query historical windows so replays are repeatable.",
        "Score top-3 accuracy, time to first useful hypothesis, wrong-action rate, and abstain rate.",
        "Grade RCA drafts with a rubric and an LLM judge, checked against human ratings first.",
        "Keep a held-out incident set for regression checks. Use shadow mode for suggestion quality and a controlled rollout for real MTTD and MTTR impact; segment by incident severity and service."
      ],
      "followups": [
        {
          "q": "What if you only have a few documented incidents?",
          "a": "Start with 30 to 50 well-documented ones, add every new postmortem, and report results with that sample size in mind."
        },
        {
          "q": "How do you score the RCA draft?",
          "a": "A rubric: correct timeline, correct root cause, concrete action items. An LLM judge applies it, validated against human scores."
        }
      ],
      "tie": "At the AI Trust Lab I built automated scoring to compare 6 frontier models side by side; this is the same discipline applied to an agent."
    },
    {
      "id": "llm-transformer",
      "topic": "llm-basics",
      "pinned": false,
      "question": "Explain transformers and attention simply.",
      "short": "A transformer turns tokens into vectors and uses attention to combine relevant context. In a causal decoder, each position attends only to preceding positions and itself. Attention and feed-forward layers transform that context into next-token scores. Prompt processing can be parallel; text generation proceeds token by token. Exact architectures vary by model.",
      "terms": [
        "Token: a chunk of text, roughly a word piece.",
        "Attention: each token weighs how relevant every other token is.",
        "Query, key, value: three learned vectors per token; query matches keys, and values carry the information.",
        "Decoder-only model: predicts the next token from the ones before it."
      ],
      "long": [
        "Tokens become vectors (embeddings) plus position information.",
        "Each layer runs self-attention, then a small feed-forward network.",
        "Multi-head attention runs several attention patterns in parallel to capture different relationships.",
        "A causal mask lets each token see only earlier tokens during generation.",
        "Attention compares every token with every other, so cost grows with the square of the length: why long context is expensive."
      ],
      "followups": [
        {
          "q": "Why is long context expensive?",
          "a": "Standard full-attention prefill has quadratic attention work in sequence length; decode reuses the KV cache, whose memory grows with sequence length. Architectural and kernel choices can change the cost."
        },
        {
          "q": "What does multi-head attention add?",
          "a": "Different heads learn different relationships, like syntax in one and references in another."
        }
      ],
      "tie": "ModelScope gave me hands-on latency, throughput, and memory measurements. I would distinguish measured bottlenecks from architectural explanations I have not profiled."
    },
    {
      "id": "llm-tokens",
      "topic": "llm-basics",
      "pinned": false,
      "question": "What are tokens and context windows, and why do they matter in production?",
      "short": "Tokens are the chunks a model reads, about 3 to 4 characters of English each. The context window is how many tokens fit in one request, prompt plus answer. In production they set cost, latency, and what the model can see, so I budget them like memory.",
      "terms": [
        "Token: the unit models read and bill by.",
        "Context window: the maximum tokens per request, input plus output.",
        "Time to first token: delay before output starts; grows with input length.",
        "Prompt caching: reusing a shared prompt prefix to save cost and time."
      ],
      "long": [
        "You pay for input and output tokens; output is slower because it is generated one at a time.",
        "Long inputs raise time to first token and cost every call.",
        "Models attend less reliably to the middle of very long inputs, so more context is not always better.",
        "Retrieve and rerank the right few chunks instead of pasting everything.",
        "Cap tool output and summarize long histories in agents."
      ],
      "followups": [
        {
          "q": "How do you keep an agent within budget?",
          "a": "Per-run token and step caps, trimmed tool outputs, summarized history, and cached shared prefixes."
        }
      ],
      "tie": "The triage agent design caps tokens per incident for exactly this reason."
    },
    {
      "id": "llm-sampling",
      "topic": "llm-basics",
      "pinned": false,
      "question": "What do temperature and top-p do?",